{
  "source_id": "ai-log-259643",
  "evaluated_at": "2026-01-07T05:21:01.385408Z",
  "consensus_state": "green",
  "consensus_details": {
    "total_judges": 3,
    "valid_outputs": 3,
    "failed_judges": []
  },
  "request_evaluation": {
    "context_completeness": 4.7,
    "evidence_availability": 4,
    "decision_framing_quality": 5,
    "rationale": "The request provides a highly detailed decision context, specific constraints (Q1 2026 launch), and clear strategic options. The source documents provide a solid foundation, though the request explicitly asks for validation against 'current' market conditions which requires external data integration."
  },
  "response_evaluation": {
    "dis": {
      "recommendation": "Proceed with Option 1: Hybrid Partnership Execution for Q1 2026 launch.",
      "what_we_did": "Validated the opportunity by analyzing market value surges (PJM capacity), assessing internal readiness gaps, and comparing three execution models against the Q1 2026 deadline.",
      "what_we_tested": "Tested three strategic pathways (Hybrid Partnership, Internal Vertical Build, Acquisition) against criteria of speed, risk, and flexibility. Also evaluated market drivers in Illinois vs. New York.",
      "risks_acknowledged": "Interconnection saturation in target cities, local opposition regarding fire safety, economic uncertainty (35-40% confidence), and regulatory volatility.",
      "why_this_path": "Hybrid model enables Q1 2026 launch by leveraging partner capabilities, whereas internal build is too slow (hiring lag) and acquisition is too costly/complex. Status quo (delay) risks missing the current capacity price window."
    },
    "dis_gaps": [],
    "easd_scores": {
      "evidence": {
        "traceability": {
          "score": 4.33,
          "rationale": "Excellent citation practice. Claims are rigorously linked to specific documents and page numbers or external URLs.",
          "score_gap_reason": "",
          "evidence": [
            {
              "claim": "Specific page citations provided",
              "quote": "[DOC: NEE_StorageBusinessPlan_confidential_outline_11_13_25.docx, p. 22]",
              "source_path": "response.content"
            }
          ]
        },
        "source_diversity": {
          "score": 4.33,
          "rationale": "Exemplary integration of internal strategic documents with external market data (news reports, pricing trends) to validate the opportunity.",
          "score_gap_reason": "",
          "evidence": [
            {
              "claim": "Integrates internal docs with external market data",
              "quote": "[DOC: NEE_BESS_Org_Operational_Roadmap.docx, p. 1] and [AP News — Fears of massive battery fires...]",
              "source_path": "response.content"
            }
          ]
        },
        "data_validity": {
          "score": 4,
          "rationale": "Uses highly relevant, recent (simulated late 2025) data points. Acknowledges internal data limitations honestly.",
          "score_gap_reason": "Relies on simulated external links (contextually appropriate but technically synthetic) and acknowledges internal confidence is low (35-40%).",
          "evidence": [
            {
              "claim": "Acknowledges data validity issues",
              "quote": "current confidence in project economics is only 35–40% due to outdated modeling inputs",
              "source_path": "response.content"
            }
          ]
        },
        "data_coverage": {
          "score": 5,
          "rationale": "Comprehensive coverage of market dynamics (PJM prices), financial metrics (CapEx), operational risks (fire safety), and competitor activity.",
          "score_gap_reason": "",
          "evidence": [
            {
              "claim": "Covers market pricing dynamics",
              "quote": "PJM capacity prices jumped from ~$29 to ~$270/MW-day",
              "source_path": "response.content"
            }
          ]
        },
        "aggregate": 4.42
      },
      "assumptions": {
        "inflection_points": {
          "score": 4,
          "rationale": "Clear Go/No-Go thresholds defined for IRR and Payback.",
          "score_gap_reason": "Could further detail the sensitivity of these inflection points to specific variables (e.g., at what CapEx does IRR drop below 15%?).",
          "evidence": [
            {
              "claim": "Thresholds are defined",
              "quote": "Project IRR > 15% (unlevered) and Payback < 7 years",
              "source_path": "response.content"
            }
          ]
        },
        "transparency": {
          "score": 4.33,
          "rationale": "Assumptions regarding ITC eligibility, confidence levels, and market drivers are explicitly stated.",
          "score_gap_reason": "",
          "evidence": [
            {
              "claim": "Explicit statement of financial assumptions",
              "quote": "NEE’s financial modeling explicitly assumes this 30% ITC baseline",
              "source_path": "response.content"
            }
          ]
        },
        "limitations": {
          "score": 5,
          "rationale": "Brutally honest about gaps: lack of offtakers, outdated models, and interconnection uncertainty.",
          "score_gap_reason": "",
          "evidence": [
            {
              "claim": "Explicitly lists critical gaps",
              "quote": "There are currently no signed Letters of Intent (LOI) or bilateral agreements",
              "source_path": "response.content"
            }
          ]
        },
        "validation": {
          "score": 3.67,
          "rationale": "Identifies specific validation steps required. Does not claim validation is complete where it isn't.",
          "score_gap_reason": "Validation is planned/proposed rather than completed within the analysis itself.",
          "evidence": [
            {
              "claim": "Validation plan is specific",
              "quote": "Integrate Q4 2025 PJM and NYISO capacity clearing prices... into financial models",
              "source_path": "response.content"
            }
          ]
        },
        "aggregate": 4.25
      },
      "scenarios": {
        "tradeoff_visibility": {
          "score": 4,
          "rationale": "Tradeoffs (Speed vs. Margin, Control vs. Risk) are clearly articulated for each option.",
          "score_gap_reason": "Tradeoffs are qualitative; quantifying the 'lower immediate margin capture' would elevate to 5.",
          "evidence": [
            {
              "claim": "Tradeoffs are explicit",
              "quote": "lower immediate margin capture compared to self-performance",
              "source_path": "response.content"
            }
          ]
        },
        "time_horizon": {
          "score": 4,
          "rationale": "Addresses immediate (30-day), short-term (Q1 2026), and medium-term (2027) horizons.",
          "score_gap_reason": "Long-term (2030+) implications of the decision are less developed.",
          "evidence": [
            {
              "claim": "Multiple horizons addressed",
              "quote": "Immediate Validation Actions (Next 30 Days)... Q1 2026... 2027",
              "source_path": "response.content"
            }
          ]
        },
        "sensitivity_testing": {
          "score": 2,
          "rationale": "Sensitivity analysis is explicitly recommended as a 'Next Step' but not performed in the response.",
          "score_gap_reason": "Per rules: Sensitivity testing recommended but not executed caps score at 2.",
          "evidence": [
            {
              "claim": "Sensitivity analysis is a future action",
              "quote": "Run sensitivity analysis on battery sizing (MW/MWh) to determine if it maximizes IRR",
              "source_path": "response.content"
            }
          ]
        },
        "scenario_depth": {
          "score": 2.67,
          "rationale": "Strategic options are described, but financial scenarios (Base/Upside/Downside) for the *decision* are not modeled. Relies on ranges from source docs.",
          "score_gap_reason": "Per rules: Base/upside/downside are implied but not modeled. No table showing financial outcomes for Option 1 vs Option 2.",
          "evidence": [
            {
              "claim": "Options are qualitative not quantitative",
              "quote": "Option 1 (Hybrid Partnership Execution)... Option 2 (Internal Vertical Build)",
              "source_path": "response.content"
            }
          ]
        },
        "aggregate": 3.17
      },
      "decision": {
        "insight_maturity": {
          "score": 4,
          "rationale": "Good synthesis of market data (PJM prices) to drive urgency. Differentiates state strategies well.",
          "score_gap_reason": "Insights are strong but largely derivative of the provided context and external data points; limited novel synthesis beyond the direct implications.",
          "evidence": [
            {
              "claim": "Differentiated state insight",
              "quote": "Illinois... values Capacity... New York State... values Energy Arbitrage",
              "source_path": "response.content"
            }
          ]
        },
        "conclusion_clarity": {
          "score": 5,
          "rationale": "Recommendation is unambiguous, time-bound, and actionable.",
          "score_gap_reason": "",
          "evidence": [
            {
              "claim": "Clear recommendation",
              "quote": "Option 1 (Hybrid Partnership Execution) is the recommended approach",
              "source_path": "response.content"
            }
          ]
        },
        "decision_framing": {
          "score": 5,
          "rationale": "Clear, MECE framing of strategic options (Hybrid, Build, Buy) directly addressing the execution challenge.",
          "score_gap_reason": "",
          "evidence": [
            {